Brand,Name,EWG,Category,Cancer,Allergies,Toxicity,Restriction,Label,Certification
,J Beverly Hill Hold Me Lite,09,Hair Spray,MODERATE,HIGH,MODERATE,HIGH,"Ingredients from packaging:
ALCOHOL DENAT, HYDROFLUOROCARBON 152A, OCTYLACRYLAM IDE/ACRYLATES/BUTYLAMINOETHYL METHACRYLATE COPOLYMER, AMINOMETHYL PROPANOL, PHENYL TRIMETHICONE, PEG/PPG-17/18 DIMETHICONE, TRIETHYL CITRATE, FRAGRANCE/PARFUM, LINALOOL, LIMONENE, BENZYL BENZOATE, CITRON ELLOL, METHYL EUGENOL, ETHYLHEXYL METHOXYCINNAMATE","Product's animal testing policies,Unknown"
Marc Anthony,Marc Anthony Strictly Curls Curl Booster,09,Hair Spray,LOW,HIGH,MODERATE,HIGH,"Ingredients from packaging:
ALCOHOL DENAT., AQUA/ WATER/EAU, PVP, VP/VA COPOLYMER, PHENOXYETHANOL, PROPYLENE GLYCOL, AMINOMETHYL PROPANOL, STYRENE/VP COPOLYMER, LIMONENE, PARFUM (FRAGRANCE), CYCLOTETRASILOXANE, TOCOPHERYL ACETATE, HEXYL CINNAMAL, BENZYL BENZOATE, HYDROLYZED SILK, CITRAL, SORBIC ACID, LINALOOL, BENZYL ALCOHOL, POTASSIUM SORBATE, SODIUM BENZOATE, CI 19140 (YELLOW 5).","Product's animal testing policies,Unknown"
Biosilk,BioSIlk Silk Therapy Shine On,09,Hair Spray,LOW,HIGH,MODERATE,HIGH,"Ingredients from packaging:
Cyclotetrasiloxane, Isobutane, Cyclopentasiloxane, Propane, Alcohol Denat., C12-15 Alkyl Benzoate, Phenyl Trimethicone, Panthenol, Ethyl Ester of Hydrolyzed Silk, Ethylhexyl Methoxycinnamate, Phenoxyethanol, Parfum (Fragrance), Benzyl Benzoate, Hexyl Cinnamal, Linalool, Alpha- Isomethyl Ionone, Citronellol, Geraniol, Hydroxycitronellal, Butylphenyl Methylpropional","Product's animal testing policies,Unknown"
Sexy Hair,Sexy Hair Big Sexy Hair Spray and Stay Intense Hold Hairspray,09,Hair Spray,MODERATE,HIGH,MODERATE,HIGH,"Ingredients from packaging:
Alcohol Denat., Hydrofluorocarbon 152a, Octylacrylamide, Acrylates, Butylaminoethyl Methacrylate Copolymer, Aminomethyl Propanol, Water, Aqua, Eau, PEG, PPG-17, 18 Dimethicone, Triethyl Citrate, Ethylhexyl Methoxycinnamate, Pentaerythrityl Tetracaprylate, Tetracaprate, Phenyl Trimethicone, AMP-Isostearoyl Hydrolyzed Wheat Protein, Olus Oil, Caryocar Coriaceum Seed Oil , Panthenol, Polysorbate 80, Quaternium-52, Hydrolyzed Vegetable Protein PG-Propyl Silanetriol, Octadecyl Di-t-butyl-4-hydroxyhydrocinnamate, PPG-12 Dimethicone, Keratin, Propylene Glycol, Disodium EDTA, BHT, Phenoxyethanol, Potassium Sorbate, Imidazolidinyl Urea, Methylparaben, Fragrance, Parfum, Limonene, Hexyl Cinnamal, Benzyl Salicylate, Linalool","Product's animal testing policies,Unknown"
,L'anza KHO Lustrous Finishing Spray,09,Hair Spray,LOW,HIGH,MODERATE,HIGH,"Ingredients from packaging:
Alcohol Denat., Hydrofluorocarbon 152a, Octylacrylamide/acrylates/ Butylaminoethyl Methacrylate Copolymer, Keratin Amino Acids, Crambe Abyssinica Seed Oil, Orbignya Speciosa Kernel Oil, Euterpe Oleracea Fruit Oil, Coffea Arabica Seed Oil, Copaifera Officinalis Resin, Astrocaryum Murumuru Seed Butter, Cereus Grandiflorus Flower Extract, Dimethiconol Meadowfoamate, Sodium Pca, Magnesium Pca, Zinc Pca, Manganese Pca, Ethylhexyl Methoxycinnamate, Aminomethyl Propanol, Benzophenone-3, Triethyl Citrate, PEG/PPG-17/18 Dimethicone, Phenyl Trimethicone, Ampisostearoyl Hydrolyzed Wheat Protein, Fragrance (Parfum), Limonene, Benzyl Benzoate, Linalool","Product's animal testing policies,Unknown"
Aquage,Aquage Beyond Body Sealing Spray,09,Hair Spray,MODERATE,HIGH,MODERATE,HIGH,"Ingredients from packaging:
SD ALCOHOL 40-B (ALCOHOL DENAT.), WATER (AQUA, EAU), VP/VA COPOLYMER, HELIANTHUS ANNUUS (SUNFLOWER) SEED EXTRACT, PALMARIA PALMATA EXTRACT, SARGASSUM FILIPENDULA EXTRACT, LAMINARIA DIGITATA EXTRACT, HIMANTHALIA ELONGATA EXTRACT, CHONDRUS CRISPUS EXTRACT, MACROCYSTIS PYRIFERA (KELP) EXTRACT, LAMINARIA SACCHARINA EXTRACT, HYDROLYZED RHODOPHYCEA EXTRACT, ASCOPHYLLUM NUDOSUM EXTRACT, GELIDIELLA ACEROSA EXTRACT, PELVETIA CANALICULATA EXTRACT, HYPNEA MUSCIFORMIS EXTRACT, UNDARIA PINNATIFIDA EXTRACT, ENTEROMORPHA COMPRESSA EXTRACT, THERMUS THERMOPHILLUS FERMENT, OCTYLACRYLAMIDE/ACRYLATES/BUTYLAMINOETHYL METHACRYLATE COPOLYMER, GLYCERIN, PVP, AMINOMETHYL PROPANOL, BUTYLENE GLYCOL, HYDROLYZED KERATIN, HYDROLYZED SOY PROTEIN, HYDROLYZED OAT PROTEIN, HYDROLYZED WHEAT PROTEIN, HYDROLYZED WHEAT PROTEIN/PVP CROSSPOLYMER, CITRIC ACID, PHENOXYETHANOL, BENZYL ALCOHOL, POTASSIUM SORBATE, EDTA, SODIUM BENZOATE, SORBIC ACID, BENZOIC ACID, ETHYLHEXYLGLYCERIN, BENZYL SALICYLATE, CITRAL, HYDROXYCITRONELLAL, HYDROXYISOHEXYL 3-CYCLOHEXENE CARBOXALDEHYDE, LIMONENE, LINALOOL, BUTYLPHENYL METHYLPROPIONAL, FRAGRANCE (PARFUM)","Product's animal testing policies,Unknown"
Kenra,Kenra Professionals Shine Spray,09,Hair Spray,LOW,HIGH,MODERATE,HIGH,"Ingredients from packaging:
Cyclotetrasiloxane, Isobutane, Denatured Alcohol (SD Alcohol 40), Hydrofluorocarbon 152a, Cyclopentasiloxane, C12-15 Alkyl Benzoate, Phenyl Trimethicone, Propylene Glycol Dibenzoate, Ethyl Ester of Hydrolyzed Silk, Parfum/Fragrance, PEG-8 Methicone, Phytantriol, Panthenyl Ethyl Ether, Ethylheyl Methoxycinnamate, Butylene Glycol, Helianthus Annuus Seed Extract.","Product's animal testing policies,PETA Cruelty-free Companies"
Fright Night,"Fright Night Colored Hair Spray, Spooky Silver",10,Hair Color And Bleaching,MODERATE,HIGH,MODERATE,HIGH,"Ingredients from packaging:
ALCOHOL DENAT., HYDROFLUOROCARBON 152A, POLYACRYLIC ACID, FRAGRANCE (PARFUM) MAY CONTAIN: MICA, BISMUTH OXYCHLORIDE (CI 77163), ALUMINUM POWDER (CI 77000), TITANIUM DIOXIDE (CI 77891), IRON OXIDES (CI 77491), IRON OXIDES (CI 77492), IRON OXIDES (CI 77499), GREEN 8 (CI 59040), MANGANESE VIOLET (CI 77742), ORANGE 10 (CI 45425), ULTRAMARINES (CI 77007)","Product's animal testing policies,Unknown"
Living proof,Living Proof Frizz Finishing Humidity Shield Hairspray,10,Hair Spray,MODERATE,HIGH,HIGH,HIGH,"Ingredients from packaging:
HYDROFLUOROCARBON 152A, ALCOHOL DENAT., WATER/EAU/AQUA, OCTAFLUOROPENTYL METHACRYLATE (OFPMA), VINYL CAPROLACTAM/VP/DIMETHYLAMINOETHYL METHACRYLATE COPOLYMER, ETHYLHEXYL METHOXYCINNAMATE, LINOLEAMIDOPROPYL ETHYLDIMONIUM ETHOSULFATE, BUTYLENE GLYCOL, PROPYLENE GLYCOL DIBENZOATE, PPG-5-CETETH-20, FRAGRANCE, CITRONELLOL, BUTYLPHENYL METHYLPROPIONAL, CITRAL.","Product's animal testing policies,Unknown"
Sebastian Professional,Sebastian Professional SHINE DEFINE HAIR SHINE SPRAY,10,Hair Spray,HIGH,HIGH,MODERATE,HIGH,"Ingredients from packaging:
ALCOHOL DENAT., AQUA/WATER/EAU, BUTYL ESTER OF PVM/MA COPOLYMER, AMINOMETHYL PROPANOL, GLYCERIN, N-BUTYL ALCOHOL, PROPYLENE GLYCOL, POLYSORBATE 20, PANTHENOL, PARFUM/FRAGRANCE, PEG-12 DIMETHICONE, ETHYLHEXYL METHOXYCINNAMATE, PEG-75 LANOLIN, HYDROXYISOHEXYL 3-CYCLOHEXENE CARBOXALDEHYDE, AMYL CINNAMAL, SODIUM PCA, QUARTZ, LINALOOL, SORBIC ACID, POTASSIUM SORBATE, BENZYL SALICYLATE, HEXYL CINNAMAL, BUTYLPHENYL METHYLPROPIONAL, GERANIOL, PHOSPHORIC ACID, CYCLOPENTASILOXANE, DIMETHICONE, BHT, TOCOPHEROL","Product's animal testing policies,PETA Cruelty-free Companies"
CHI,CHI Shine Infusion Hair Spray,10,Hair Spray,MODERATE,HIGH,MODERATE,HIGH,"Ingredients from packaging:
Cyclotetrasiloxane, Isobutane, Cyclopentasiloxane, Propane, C12-15 Alkyl Benzoate, Alcohol Denat., Phenyl Trimethicone, Panthenol, Ethyl Ester of Hydrolyzed Silk, Ethylhexyl Methoxycinnamate, Phenoxyethanol, Parfum, Fragrance, Benzyl Benzoate, Butylphenyl Methylpropional, Hydroxyisohexyl 3-Cyclohexene Carboxaldehyde, Hexyl Cinnamal, Citronellol, Coumarin, Linalool, Silica, Alumina, Titanium Dioxide
Directions from packaging:
For instant shine and finish, spray on evenly throughout wet or dry hair.
Warnings from packaging:
: FLAMMABLE. PRESSURIZED CONTAINER. Protect from sunlight and do not expose to temperature exceeding 50C (120F). Do not pierce or burn, even after use. Do not spray on a naked flame or any incandescent material. Keep away from sources of ignition - no smoking. Avoid spraying in eyes. Keep out of reach of children. Use only as directed. Intentional misuse by deliberately concentrating and inhaling the contents can be harmful or fatal.","Product's animal testing policies,Unknown"
Salon Grafix,Salon Grafix Extra Super Hold Professional Shaping Xtra Hair Spray,10,Hair Spray,MODERATE,HIGH,HIGH,HIGH,"Ingredients from packaging:
SD ALCOHOL 40-B, HYDROFLUOROCARBON 152A, ETHYL ESTER OF PVM/MA COPOLYMER, OCTYLACRYLAMIDE/ACRYLATES/BUTYLAMINOETHYL METHACRYLATE COPOLYMER, AMINOMETHYL PROPANOL, DIMETHYL STEARAMINE, PEG-75 LANOLIN, RETINYL PALMITATE, ASCORBIC ACID, TOCOPHERYL ACETATE, WATER, VITIS VINIFERA (GRAPE) SEED EXTRACT, PANTHENOL, LINOLEAMIDOPROPYL ETHYLDIMONIUM ETHOSULFATE, DIMETHYL LAURAMINE ISOSTEARATE, LACTAMIDE MEA, CYCLOTETRASILOXANE, CYCLOPENTASILOXANE, ETHYLHEXYL METHOXYCINNAMATE, GLYCERIN, FRAGRANCE
Warnings from packaging:
Flammable. Contents under pressure. Do not use near fire, flame or while smoking. Do not puncture or incinerate. Do not store at temperatures above 120&deg; F. Use only as directed. Avoid spraying in eyes or open wounds. Intentional misuse by deliberately concentrating and inhaling contents can be harmful or fatal. Keep out of reach of children.","Product's animal testing policies,Unknown"
Kenra,Kenra Professionals Dry Oil Control Spray 14,10,Hair Spray,MODERATE,HIGH,HIGH,HIGH,"Ingredients from packaging:
Hydrofluorocarbon, 152a, alcohol denat., isobutane, octylacrylamide/acrylates/butylaminoethyl, methacrylate copolymer, aqua/water/eau, aminomethyl propanol, polyurethane-14, caprylyl methicone, amp-acrylates copolymer, fragrance/parfum, glycerin, ethylhexyl methoxycinnamate, cetrimonium, chloride, vitis vinifera (grape) seed oil, prunus amygdalus dulcis (sweet, almond) oil, macadamia ternifolia seed oil, argania spinosa kernel oil, cocos, nucifera (coconut) oil, alpha-isomethyl ionone, butylphenyl methylpropional, citronellol, hexyl cinnamal, limonene, linalool.","Product's animal testing policies,PETA Cruelty-free Companies"
Cantu,Cantu Shea Butter Oil Sheen Deep Conditioning Spray,10,Conditioner,MODERATE,HIGH,HIGH,HIGH,"Ingredients from packaging:
PARAFFINUM LIQUIDUM (MINERAL OIL), BUTANE, PROPANE, LANOLIN ALCOHOL, BUTYROSPERMUM PARKII (SHEA) BUTTER, PARFUM (FRAGRANCE), PETROLATUM, ISOPROPYL MYRISTATE, PARAFFIN, PROPYLPARABEN, LINOLEAMIDOPROPYL ETHYLDIMONIUM ETHOSULFATE, ISOSTEARIC ACID, DIMETHYL LAURAMINE ISOSTEARATE, TOCOPHEROL(VITAMIN E), RETINYL PALMITATE, BENZOPHENONE-4, PROPYLENE GLYCOL, ISOSTEAROYL HYDROLYZED SILK, CITRAL, COUMARIN, LINALOOL, HEXYL CINNAMAL, LIMONENE, BENZYL SALICYLATE.","Product's animal testing policies,Unknown"
Rock the Locks,Rock the Locks Glitter Hairspray,10,Hair Spray,LOW,HIGH,MODERATE,HIGH,"Ingredients from packaging:
AQUA, ALCOHOL DENAT., PROPYLENE GLYCOL, ACRYLATES COPOLYMER, POLYETHYLENE TEREPHTHALATE, CITRUS AURANTIUM DULCIS (ORANGE) PEEL OIL, GLYCINE SOJA (SOYBEAN) OIL, GLYCERIN, VACCINIUM ANGUSTIFOLIUM (BLUEBERRY) FRUIT EXTRACT, ANANAS SATIVUS (PINEAPPLE) FRUIT EXTRACT, MUSA SAPIENTUM (BANANA) FRUIT EXTRACT, PYRUS MALUS (APPLE) FRUIT EXTRACT, PRUNUS AVIUM (SWEET CHERRY) FRUIT EXTRACT, CITRUS AURANTIUM DULCIS (ORANGE) PEEL EXTRACT, RUBUS IDAEUS (RASPBERRY) FRUIT EXTRACT, VITIS VINIFERA (GRAPE) SEED EXTRACT, POLYSORBATE 20, ACRYLATES/BEHENETH-25 METHACRYLATE COPOLYMER, POLYURETHANE-33, ALUMINUM, FRAGRANCE, DISODIUM EDTA, CAPRYLYL GLYCOL, PHENOXYETHANOL, SODIUM HYDROXIDE","Product's animal testing policies,Unknown"
Qet Botanicals,Qet Botanicals Natural Sea Spray,EWG Verified,Hair Spray,,,,,"Ingredients from packaging:
Distilled Water, Maris Sal (Himalayan Pink Salt), Lavandula Angustifolia (Lavender) Flower Oil*, Rosmarinus Officinalis (Rosemary) Flower Oil*, Daucus Carota (Carrot) Seed Oil*, Rubus Idaeus (Red Raspberry) Seed Oil. *Organic Ingredient
Warnings from packaging:
If you have a negative reaction, discontinue use and consult with a health professional.","EWG Verified,Product's animal testing policies,Unknown"
Ivy &amp; Elder,Ivy & Elder Wear the Wind Wave Spray,EWG Verified,Hair Spray,,,,,"Ingredients from packaging:
Water (Aqua), Alcohol Denat.*, Sodium Polyitaconate, Aloe Barbadensis Leaf Juice*, Propanediol, Undecane, Crataegus Monogyna (Hawthorn) Berry Extract, Glycerin, Panthenol, Tridecane, Tetrasodium Glutamate Diacetate, Citric Acid, Ethylhexylglycerin, Potassium Sorbate.
Warnings from packaging:
For external use only. Keep away from eyes. If irritation occurs, discontinue use.","EWG Verified,Product's animal testing policies,Leaping Bunny"
Every Man Jack,"Every Man Jack, Texturizing Surf Spray for All Hair Types, Sea Salt",01,Hair Spray,LOW,LOW,LOW,MODERATE,"Ingredients from packaging:
WATER (AQUA), MALTODEXTRIN/VP COPOLYMER, POLYSORBATE 20, GLYCERIN, MAGNESIUM SULFATE, SODIUM CHLORIDE, SORBITOL, PHENOXYETHANOL, AMP-ACRYLATES/ALLYL METHACRYLATE COPOLYMER, PANTHENOL, ETHYLHEXYLGLYCERIN, SEA SALT, CHRITHMUM MARITINUM (SEA FENNEL) EXTRACT","Product's animal testing policies,Unknown"
Carina Organics,"Carina Organics Fast Drying Hairspray, Unscented",01,Hair Spray,LOW,LOW,LOW,LOW,"Ingredients from packaging:
Ethanol (ethyl alcohol), Acacia senegal (gum) extract, Pinus banksiana (pine) extract, Matricaria chamomilla (chamomile) flower extract, Urtica dioca (nettle) leaf extract, Taraxacum officinale (dandelion) leaf extract, Trifolium pratense (clover) flower extract, Olea europaea (olive) fruit oil, Cucurbita pepo (pumpkin) seed oil.
Warnings from packaging:
Caution: Contents are flammable Keep away from heat or flame.","Product's animal testing policies,Unknown"
Carina Organics,"Carina Organics Fast Drying Hairspray, Sweet Pea",01,Hair Spray,LOW,LOW,LOW,LOW,"Ingredients from packaging:
Ethanol (ethyl alcohol), Acacia senegal (gum) extract, Pinus banksiana (pine) extract, Matricaria chamomilla (chamomile) flower extract, Urtica dioca (nettle) leaf extract, Taraxacum officinale (dandelion) leaf extract, Trifolium pratense (clover) flower extract, Lathyrus odoratus (sweet pea) flower extract, Olea europaea (olive) fruit oil, Cucurbita pepo (pumpkin) seed oil.
Warnings from packaging:
Caution: Contents are flammable Keep away from heat or flame.","Product's animal testing policies,Unknown"
JOHN MASTERS ORGANICS,"John Masters Organics Sea Mist Spry, Sea Salt & Lavender",02,Hair Spray,LOW,LOW,MODERATE,MODERATE,"Ingredients from packaging:
ALOE BARBADENSIS LEAF JUICE (ALOE)* GYCERIN*, SD ALCOHOL 38-B (LAVENDER BLENDED ALCOHOL)* SODIUM CHLORIDE (SEA SALT BLEND), LINALOOL+, GERANOL+ LIMONENE+, COUMARIN+","Product's animal testing policies,PETA Cruelty-free Companies"
,Kcprofessional Very Sensitive & Strong Hairspray,02,Hair Spray,LOW,LOW,LOW,HIGH,"Ingredients from packaging:
ALCOHOL DENAT., HYDROFLUOROCARBON 152A, ACRYLATES COPOLYMER, OCTYLACRYLAMIDE / ACRYLATES / BUTYLAMINOETHYL METHACRYLATE COPOLYMER, AMINOMETHYL PROPANOL, PEG-12 DIMETHICONE, PANTHENOL, COCODIMONIUM HYDROXYPROPYL HYDROLYZED SILK, WATER (AQUA).","Product's animal testing policies,Unknown"
Druide,"Druide Styling Hairspray, Alchohol-Free",02,Hair Spray,LOW,MODERATE,LOW,MODERATE,"Ingredients from packaging:
Aqua, Aloe Barbadensis Leaf Juice*, Saccharum Officinarum (Sugarcane) Extract*, Urtica Dioica (Nettle) Extract*, Equisetum Arvense (Horstail ) Extract*, Acchille Millefolium Extract*, Lavandula Angustifolia (Lavande) Extract*, Sodium Citrate, Glycerin, Arginine, Galactoarabinan, Levulinic Acid, Potassium Alum, Sodium Gluconate, Potassium Sorbate.","Product's animal testing policies,PETA Cruelty-free Companies"
Naturtint,Naturtint Hair Spray,02,Hair Spray,LOW,HIGH,LOW,HIGH,"Ingredients from packaging:
WATER (AQUA), SODIUM POLYITACONATE, LEMON (CITRUS LIMON) FRUIT WATER, SUNFLOWER (HELIANTHUS ANNUUS) SEED EXTRACT, HYDROLYZED BAOBAB (ADANSONIA DIGITATA) SEED EXTRACT, GLYCERIN, SODIUM BENZOATE, POTASSIUM SORBATE, BENZYL ALCOHOL, CITRIC ACID.","Product's animal testing policies,Unknown"
Rainwater Botanicals,"Rainwater Botanicals Spray For Hair All Natural, Dead Sea Salt",02,Hair Spray,LOW,LOW,LOW,LOW,"Ingredients from packaging:
distilled water, dead sea salts, organic aloe, essential oils","Product's animal testing policies,Unknown"
Organic Excellence,"Organic Excellence Revitalizing Hair Therapy Styling Spray, Fragrance Free",02,Hair Spray,LOW,HIGH,LOW,MODERATE,"Ingredients from packaging:
PURIFIED WATER, GUAR GUM (GUAR BEAN), VEGETABLE PROTEIN, VEGETABLE GLYCERIN, PANTHENOL (VITAMIN B5), LAVENDER EXTRACT*, ROSEMARY EXTRACT*, PEPPERMINT OIL*, GRAPE SEED EXTRACT*","Product's animal testing policies,Unknown"
Young King Hair Care,Young King Hair Care Black Panther Curl Oil Refreshing Spray,02,Hair Spray,LOW,HIGH,LOW,MODERATE,"Ingredients from packaging:
Helianthus Annuus (Sunflower) Seed Oil, Caprylic/Capric Triglyceride, Ethylhexyl Olivate, Cocos Nucifera (Coconut) Fruit Extract, Tocopherol(Vitamin E), Adansonia Digitata(Baobab) Seed Oil, Cananga Odorata(Ylang Ylang) Flower Oil, Lavandula Angustifolia (Lavender) Flower Oil/ Flower/Leaf/Stem Extract, Lavandula Hybrida Oil, Persea Gratissima (Avocado) Oil, Sclerocarya Birrea (Marula) Seed Oil, Squalane","Product's animal testing policies,Unknown"
,No Nothing Sensitive Strong Hold Hairspray,02,Hair Spray,LOW,LOW,LOW,HIGH,"Ingredients from packaging:
Alcohol Denat., Hydrofluorocarbon 152A, Acrylates Copolymer, Octylacrylamide / Acrylates /Butylaminoethyl Methacrylate Copolymer, AminomethylPropanol, PEG-12 Dimethicone, Panthenol, CocodimoniumHydroxypropyl Hydrolyzed Silk, Water (Aqua)","Product's animal testing policies,Unknown"
Artnaturals,artNaturals Sea Salt Spray,02,Hair Spray,LOW,MODERATE,LOW,HIGH,"Ingredients from packaging:
Water, Magnesium Sulfate, Gly- Cerin, Saccharum Officinarum (Sugar Cane), Extract, Stearami- Dopropyl Dimethylamine, Cetyl Alcohol, Stearyl Alcohol, Peg-40, Hydrogenated Castor Oil, Cocosnucifera (Coconut) Oil, Cocos Nucifera (Coconut) Extract, Jug Lans Nigra (Black Walnut) Leaf Extract, Citrus Tangerina (Tangerine) Extract, Sea Salt, Hydrolyzedwheat Protein, Hydrolyzed Wheatstarch, Corn Starch, Modified, Glyceryl Stearate, Trisodium Ethyl Enediamine Disuccinate, Caprylhydroxamic Acid, Caprylyl Glycol, Lactic Acid, Fragrance.","Product's animal testing policies,Unknown"
Young King Hair Care,Young King Hair Care Wakandan Refreshing Oil Spray,02,Hair Spray,LOW,HIGH,LOW,MODERATE,"Ingredients from packaging:
HELIANTHUS ANNUUS (SUNFLOWER) SEED OIL, CAPRYLIC/CAPRIC TRIGLYCERIDE, ETHYLHEXYL OLIVATE, COCOS NUCIFERA (COCONUT) FRUIT EXTRACT, TOCOPHEROL(VITAMIN E), ADANSONIA DIGITATA(BAOBAB) SEED OIL, CANANGA ODORATA(YLANG YLANG) FLOWER OIL, LAVANDULA ANGUSTIFOLIA (LAVENDER) FLOWER OIL/ FLOWER/LEAF/STEM EXTRACT, LAVANDULA HYBRIDA OIL, PERSEA GRATISSIMA (AVOCADO) OIL, SCLEROCARYA BIRREA (MARULA) SEED OIL, SQUALANE","Product's animal testing policies,Unknown"
Consort,Consort Hair Spray for Men,02,Hair Spray,LOW,LOW,LOW,HIGH,"Ingredients from packaging:
ALCOHOL DENAT., HYDROFLUOROCARBON 152A, OCTYLACRYLAMIDE/ACRYLATES/BUTYLAMINOETHYLMETHACRYLATE COPOLYMER, VA/CROTONATES/VINYL NEODECANOATE COPOLYMER, AMINOMETHYL PROPANOL, DIMETHYL STEARAMINE","Product's animal testing policies,Unknown"
Afterworld Organics,Afterworld Organics Flex Hold Natural Hairspray,02,Hair Spray,LOW,LOW,LOW,MODERATE,"Ingredients from packaging:
Filtered Water, Arrowroot, Corn Syrup, Brown Rice Flour, Glycerin, Aloe Juice, Xanthan Gum, Sodium Benzoate, Essential Oils of Lavender, Cedarwood, and Geranium","Product's animal testing policies,Leaping Bunny"
Blumaan,BluMaan COASTAL TEXTURE SALT SPRAY,03,Hair Spray,LOW,HIGH,LOW,HIGH,"Ingredients from packaging:
Water/Aqua/Eau, Sea Salt (Sodium Chloride), VP/VA Copolymer, Polysorbate-80, Maltodextrin / VP Copolymer, Glycerin, Cucumis Sativus (Cucumber) Fruit Extract, Phenoxyethanol, Laminaria Digitata (Algae) Extract, Citrus Bergamia (Bergamot) Leaf Oil, Caprylyl Glycol, Rosmarinus Officinalis (Rosemary) Leaf Extract, Rosmarinus Officinalis (Rosemary) Oil, Lavandula Augustifolia (Lavender) Flower Oil, Citrus Sinensis (Sweet Orange) Oil","Product's animal testing policies,Unknown"
Every Man Jack,"Every Man Jack, Nourishing Thickening Hair Spray, Natural Hemp",03,Hair Spray,LOW,HIGH,LOW,HIGH,"Ingredients from packaging:
WATER (AQUA), GLYCERIN, PEG-75 LANOLIN, MALTODEXTRIN/VP COPOLYMER, SORBITOL, PHENOXYETHANOL, POLYQUATERNIUM-39, ETHYLHEXYLGLYCERIN, PANTHENOL, SODIUM BENZOATE, BIOTIN, HUMULUS LUPULUS (HOPS) EXTRACT, CANNABIS SATIVA (HEMP SEED) OIL, MELALEUCA ALTERNIFOLIA (TEA TREE) LEAF OIL.","Product's animal testing policies,Unknown"
TRESemme,"Tresemme, Unscented Extra Hold Non Aerosol Hair Spray",03,Hair Spray,LOW,LOW,MODERATE,HIGH,"Ingredients from packaging:
SD ALCOHOL 40-B (ALCOHOL DENAT.), WATER (AQUA), ETHYL ESTER OF PVM/MA COPOLYMER, AMINOMETHYL PROPANOL, TRIETHYL CITRATE, PEG-12 DIMETHICONE, DIISOPROPYL ADIPATE, ASCORBIC ACID, ACETYL HEXAMETHYL INDAN.","Product's animal testing policies,Unknown"
,Peculiar Roots Locs Oil Spray,03,Hair Spray,LOW,HIGH,LOW,MODERATE,"Ingredients from packaging:
PRUNUS AMYGDALUS DULCIS (SWEET ALMOND) OIL, CAMELLIA OLEIFERA SEED OIL, SIMMONDSIA CHINENSIS (JOJOBA) SEED OIL, TOCOPHERYL ACETATE, BIOTIN, TRITICUM VULGARE (WHEAT) GERM OIL, ASCORBIC ACID (VITAMIN C), HIBISCUS SABDARIFFA SEED OIL, KIWI FRUIT EXTRACT, CITRUS AURANTIUM DULCIS (ORANGE) SEED OIL","Product's animal testing policies,Unknown"
,"Meow Meow Tweet Sea Salt Hair Spray, Aloe + Seaweed",03,Hair Spray,LOW,HIGH,LOW,MODERATE,"Ingredients from packaging:
Aloe Barbadensis Leaf Juice*, Sea Salt (Sel marin), Laminaria Digitata Extract*, Fucus Vesiculosus Extract*, Ascophyllum Nodosum Extract*, Porphyra Umbilicalis Extract*, Alaria Esculenta Extract*, Pelargonium Graveolens Flower Oil*, Cymbopogon Martini Oil*, Glycerin* * Certified organic ingredient","Product's animal testing policies,Unknown"
Suave,"Suave Max Hold Non Aerosol Hairspray, Unscented",03,Hair Spray,LOW,LOW,MODERATE,HIGH,"Ingredients from packaging:
SD Alcohol 40-B (Alcohol Denat.), Water (Aqua), Acrylates/Hydroxyesters Acrylates Copolymer, Aminomethyl Propanol, Cyclopentasiloxane, Panthenol, Tocopherol","Product's animal testing policies,Unknown"
Real Purity,Real Purity Natural Hair Spray,03,Hair Spray,LOW,MODERATE,LOW,HIGH,"Ingredients from packaging:
Purified Aqua (Water), VP/VA Copolymer, Xylityl Sesquicaprylate, Panthenol, Glycerin, Aloe Barbadensis Leaf Juice, Hamamelis Virginiana (Witch Hazel), Tilia Tomentosa Bud Extract, Calendula Officinalis Flower Extract, Antehmis Nobilis (Chamomile) Flower Extract, Tocopheryl Acetate, Aminomethyl Propanol, Citric Acid.","Product's animal testing policies,PETA Cruelty-free Companies"
TRESemme,"TRESemme Tres Two Hair Spray, Extra Firm Control Unscented",03,Hair Spray,LOW,LOW,MODERATE,HIGH,"Ingredients from packaging:
SD ALCOHOL 40-B (ALCOHOL DENAT.), HYDROFLUOROCARBON 152A, VA/CROTONATES/VINYL NEODECANOATE COPOLYMER, OCTYLACRYLAMIDE/ACRYLATES/BUTYLAMINOETHYL METHACRYLATE COPOLYMER, AMINOMETHYL PROPANOL, DIMETHYL STEARAMINE.","Product's animal testing policies,Unknown"
Eva Nyc,Eva NYC Mane Magic 10-in-1 Primer for Fine Hair Heat Protector,03,Hair Spray,LOW,HIGH,LOW,LOW,"Ingredients from packaging:
Isododecane, Neopentyl Glycol Diheptanoate, Ethylhexyl Olivate, Argania Spinosa (Argan) Kernel Oil, Helianthus Annuus (Sunflower) Seed Oil, Squalane, Fragrance","Product's animal testing policies,Unknown"
18.21 Man Made,"18. 21 Man Made Premium Hair Spray, Sweet Tobacco",03,Hair Spray,LOW,MODERATE,LOW,HIGH,"Ingredients from packaging:
Alcohol Denat, Hydrofluorocarbon 152-A,VA/Crotonates/Vinyl Neodecanoate, Copolymer, Octylacryl Amide/Acrylates/Butylaminoethyl Methacrylate Copolymer, PPG-3 Benzyl Ether Ethylhexanoate, Aminomethyl Propanol, Benzophenone-4, Fragrance (Parfum), Benzyl Alcohol, Coumarin, Limonene, Eugenol.","Product's animal testing policies,Unknown"
JOHN MASTERS ORGANICS,John Masters Organics Hair Spray,03,Hair Spray,LOW,HIGH,LOW,MODERATE,"Ingredients from packaging:
Aloe Barbadensis Leaf Juice (Aloe Vera)*, Alcohol Dent.*, Acacia Senegal Gum*, Glycerin*, Citrus Aurantium Bergamia (Bergamot) Fruit Oil*, Xanthan Gum","Product's animal testing policies,PETA Cruelty-free Companies"
Vanicream,"Vanicream Free & Clear Hairspray, Firm Hold",03,Hair Spray,LOW,MODERATE,MODERATE,HIGH,"Ingredients from packaging:
SD ALCOHOL 40-B, WATER, ACRYLATES COPOLYMER, ACRYLATES/OCTYLACRYLAMIDE COPOLYMER, PHYTANTRIOL, PEG-12 DIMETHICONE, AMINOMETHYL PROPANOL","Product's animal testing policies,Unknown"
,Nature's Brands Organic Hair Spray,03,Hair Spray,LOW,HIGH,LOW,HIGH,"Ingredients from packaging:
Purified water, organic vodka, organic brown sugar, organic sweet orange oil, organic geranium oil, organic green tea, organic sage herb, organic thyme herb, organic bergamot oil, organic olive oil, organic rosehip oil.","Product's animal testing policies,Unknown"
Eva Nyc,Eva NYC Mane Magic Primer 10-in-1 Heat Protector,03,Hair Spray,LOW,HIGH,LOW,LOW,"Ingredients from packaging:
Cyclopentasiloxane, Trimethylsiloxy-
silicate, Argania Spinosa (Argan)
Kernel Oil, Helianthus Annuus
(Sunflower) Seed Oil, Fragrance","Product's animal testing policies,Unknown"
,Demert Brands Oil Free Shine Wig & Weave,03,Hair Spray,LOW,HIGH,LOW,LOW,"Ingredients from packaging:
C 14-22 ALKANE, ISODODECANE, PHENYL TRIIMETHICONE, FRAGRANCE/PARFUM, ARGANIA SPINOSA KERNEL EXTRACT, CAPRYLIC/CAPRIC TRYGLYCERIDES.","Product's animal testing policies,Unknown"
Pacifica,Pacifica Hair and Body Mist - Flower Moon,04,Body Spray,LOW,HIGH,LOW,MODERATE,"Ingredients from packaging:
Aqua, sorbitan oleate decylglucoside crosspolymer, parfum, sodium gluconate, sodium benzoate, potassium sorbate, citric acid","Product's animal testing policies,PETA Cruelty-free Companies"
Rainwater Botanicals,"Rainwater Botanicals Hair and Body Mist, Vanilla Oakmoss",04,Body Spray,LOW,HIGH,LOW,HIGH,"Ingredients from packaging:
Water, Naturally Derived Fragrance, Vegetable Glycerin, Olive Oil PEG-7 Esters, Gluconolactone (and) Sodium Benzoate","Product's animal testing policies,Unknown"
