Brand,Name,EWG,Category,Cancer,Allergies,Toxicity,Restriction,Label,Certification
Kleem Organics,Kleem Organics Neck & Decollete Firming Cream,EWG Verified,Anti Aging,,,,,"Ingredients from packaging:
Aloe Barbadensis Leaf Juice, Aqua, Cassia Angustifolia Seed Polysaccharide, Isopropyl Palmitate, Helianthus Annuus Oil, Glyceryl Stearate SE, Cetyl Alcohol, Stearic Acid, Glycerin, Butyrospermum Parkii Butter, Simmondsia Chinesis Oil, Panthenol, Tocopherol Acetate, Camelia Sinensis Extract, Resina Propoli Extract, Xanthane Gum, Dehydroacetic Acid, Benzyl Alcohol, Tetrasodium Glutamate Diacetate, Rose Ether, Ethylhexylglycerin
Directions from packaging:
Apply your cream in upward-sweeping motions starting from the base of your neck to discourage sagging. Use a super-light hand when applying your neck cream. Use every morning and night.
Warnings from packaging:
Discontinue use if any negative reactions occur. Avoid contact with eyes. If that happens rinse immediately with water. This product may increase skin s sensitivity to the sun and increase burning. Use sunscreen, wear protective clothing and limit sun exposure. Keep out of the reach of children. For external use only.","EWG Verified,Product's animal testing policies,PETA Cruelty-free Companies"
Alder New York,Alder New York Nourishing Cream,EWG Verified,Anti Aging,,,,,"Ingredients from packaging:
: Water/ Eau, Simmondsia chinensis (jojoba) seed oil, Squalane, Glyceryl Stearate, cetyl alcohol, Cetearyl Alcohol, Bakuchiol, Tocopheryl acetate (vitamin E), DL-Panthenol (vitamin B5), Sodium Stearoyl Lactylate, Caprylyl glycol, ethylhexylglycerin
Warnings from packaging:
Avoid contact with eyes. For external use only.","EWG Verified,Product's animal testing policies,Unknown"
isoi,isoi Bulgarian Rose Intensive Lifting Spot,EWG Verified,Anti Aging,,,,,"Ingredients from packaging:
Water, Glycerin, Cetyl Ethylhexanoate, Caprylic/Capric Triglyceride, Macadamia Ternifolia Seed Oil, Cetearyl Alcohol, Glyceryl Stearate, Pentaerythrityl Tetraisostearate, Stearic Acid, Arachidyl Alcohol, Betaine, Trehalose, Polyglyceryl-3 Methylglucose Distearate, Rosa Damascena Flower Oil, Butyrospermum Parkii (Shea) Butter, Xanthan Gum, Behenyl Alcohol, Arachidyl Glucoside, Rosa Damascena Flower Water, Adenosine, Panthenol, Coptis Chinensis Root Extract, Sodium Hyaluronate, Allantoin, Palmitoyl Tripeptide-5, Castanea Crenata (Chestnut) Shell Extract, Malpighia Emarginata (Acerola) Fruit Extract, Corchorus Olitorius Leaf Extract, Brassica Oleracea Italica (Broccoli) Extract, Rosmarinus Officinalis (Rosemary) Extract, Melaleuca Viridiflora Leaf Oil, Chamomilla Recutita (Matricaria) Flower/Leaf Extract, Centella Asiatica Extract, Glycyrrhiza Glabra (Licorice) Root Extract, Scutellaria Baicalensis Root Extract, Paeonia Suffruticosa Root Extract","EWG Verified,Product's animal testing policies,Unknown"
isoi,isoi Bulgarian Rose Intensive Perfect Anti-aging Program,EWG Verified,Anti Aging,,,,,"Ingredients from packaging:
Water, Glycerin, Alcohol, Cetyl Ethylhexanoate, Caprylic/Capric Triglyceride, Betaine, Olea Europaea (Olive) Fruit Oil, Polyglyceryl-3 Methylglucose Distearate, Glyceryl StearatesSE, Allantoin, Panthenol, Adenosine, Xanthan Gum, Pleurotus Cystidiosus Ferment Filtrate, Palmitoyl Tripeptide-5, Calendula Officinalis Flower Extract, Coptis Chinensis Root Extract, Rosa Damascena Flower Oil, Castanea Crenata (Chestnut) Shell Extract, Malpighia Emarginata (Acerola) Fruit Extract, Corchorus Olitorius Leaf Extract, Brassica Oleracea Italica (Broccoli) Extract, Rosmarinus Officinalis (Rosemary) Extract, Melaleuca Viridiflora Leaf Oil, Chamomilla Recutita (Matricaria) Flower/Leaf Extract, Centella Asiatica Extract, Scutellaria Baicalensis Root Extract, Paeonia Suffruticosa Root Extract, Glycyrrhiza Glabra (Licorice) Root Extract","EWG Verified,Product's animal testing policies,Unknown"
Prima,Prima The Afterglow,EWG Verified,Anti Aging,,,,,"Ingredients from packaging:
Water (Aqua), Squalane, C13-15 Alkane, Behenyl Alcohol, Glycerin, Propanediol, Lauryl Laurate, Garcinia Indica Seed Butter, Polyglyceryl-2 Stearate, Butyrospermum Parkii (Shea) Butter, Polyglyceryl-3 Stearate, Polyhydroxystearic Acid, Cannabis Sativa (Hemp) Flower/Leaf/Stem Extract, Glyceryl Stearate SE, C26-28 Alkyl Dimethicone, Sodium Hyaluronate, Sodium Acetylated Hyaluronate, Sodium Hyaluronate Crosspolymer, Hydrolyzed Sodium Hyaluronate, Sr-Hydrozoan Polypeptide-1, Hedychium Coronarium Root Extract, Curcuma Longa (Turmeric) Root Extract, Withania Somnifera Root Extract, Palmitoyl Tripeptide-38, Emblica Officinalis Fruit Extract, Cardiospermum Halicacabum Flower/Leaf/Vine Extract, Ocimum Sanctum Leaf Extract, Ocimum Basilicum (Basil) Flower/Leaf Extract, Melia Azadirachta Flower Extract, Melia Azadirachta Extract, Melia Azadirachta Leaf Extract, Corallina Officinalis Extract, Theobroma Grandiflorum Seed Butter, Astrocaryum Murumuru Seed Butter, Astrocaryum Vulgare Kernel Oil, Platonia Insignis Seed Butter, Ribes Nigrum (Black Currant) Seed Oil, Ethylhexylglycerin, Helianthus Annuus (Sunflower) Seed Oil, Brassica Campestris (Rapeseed) Seed Oil, Sodium Benzoate, Sodium Levulinate, Fructose, Fusanus Spicatus Wood Oil, Lactobacillus Ferment, Sesamum Indicum (Sesame) Seed Oil, Hydroxypropyl Cyclodextrin, Helianthus Annuus (Sunflower) Seed Oil Unsaponifiables, Sclerotium Gum, Potassium Sorbate, Lecithin, Octyldodecanol, Pentylene Glycol, Citric Acid, Sodium Phytate, Tocopherol, Rosmarinus Officinalis (Rosemary) Leaf Extract","EWG Verified,Product's animal testing policies,PETA Cruelty-free Companies"
Sonage,Sonage Refixion Sans Retinol Creme,EWG Verified,Anti Aging,,,,,"Ingredients from packaging:
water, cocos nucifera (coconut) oil, glycerin, olea europaea (olive) oil, persea gratissima (avocado) oil, cetearyl alcohol, sclerocarya birrea (marula) oil, tetradecane, glyceryl stearate, potassium cetyl phosphate, cetearyl olivate, sorbitan olivate, bakuchiol, palmitoyl tripeptide-37, sodium hyaluronate, ceramide np, arginine, simmondsia chinensis (jojoba) oil, leuconostoc/radish root ferment filtrate, pogostemon cablin (patchouli) oil, cedrus atlantica (cedarwood) wood oil, jasminum grandiflorum (jasmine) oil, helichrysum italicum flower oil, pentylene glycol, ethylhexyglycerin, sodium dehydroacetate, xanthan gum","EWG Verified,Product's animal testing policies,PETA Cruelty-free Companies"
